{
  "observation_id": "GOOGLE-MC-20261009",
  "date": "2026-10-09",
  "query": "marii cuadros",
  "platform": "Google AI Overview",
  "observation": "Response included both Marii Cuadros and Cuadros María Luisa, with a mistaken association in introductory summary.",
  "evidence_type": "user_supplied_screenshot",
  "evidence_location": "Separate conversation attachment; do not claim embedded image in repository",
  "interpretation": "Observed displayed response only; no proof of internal knowledge graph merge, ingestion pathway, or causal mechanism.",
  "replication_status": "not_yet_replicated",
  "baseline_role": "phase2_social_ai_initial"
}
